tessoutput,name ,author
howtostickwithyouronewordallyearlong, How to stick with your one word all year long ,
sophiameassimpleartofvercomingdepressionandanxiety, Simple art of overcoming depression and anxiety ,Sophia Meas
onewordbutmanytonguesconfessionsofamulticulturalismatthewjmotyka, One word but many tongues ,Matthew J. Motyka
minimalistlivinganintroductiontominimalismcraigcrofts, Minimalist living ,Craig Crofts
kennethgloriacopelandonewordgodcanhajgeyourhealth,One word from God can change your health , Kenneth & Gloria Copeland
newyorktimesbestsellerwhenbreathbecomespaulkalanithiforewordbyabrahamverghese,#1 New York Times best seller When breath becomes air , Paul Kalanithi
aekkkasthefirstwordthesearchfortheoriginsoflanguagechristinekenneally,The first word. The search for the Origins of Language , Christine Kenneally
